{
  "$schema": "https://json-schema.org/draft/2020-12/schema",
  "title": "Complete State",
  "description": "Structured completion record written to ${OUTPUT_DIR}/COMPLETE.md.",
  "type": "object",
  "required": ["engagement_id", "completed_at", "phase_durations", "finding_count", "scope_coverage_pct"],
  "additionalProperties": false,
  "properties": {
    "engagement_id": { "type": "string", "minLength": 1 },
    "completed_at": { "type": "string", "format": "date-time" },
    "phase_durations": {
      "type": "object",
      "description": "Map of phase name → duration in seconds.",
      "additionalProperties": { "type": "number", "minimum": 0 }
    },
    "finding_count": { "type": "integer", "minimum": 0 },
    "scope_coverage_pct": { "type": "integer", "minimum": 0, "maximum": 100 },
    "supervisor_verdict_history": {
      "type": "array",
      "description": "List of {phase, verdict, timestamp} per supervisor invocation.",
      "items": {
        "type": "object",
        "required": ["phase", "verdict", "timestamp"],
        "additionalProperties": false,
        "properties": {
          "phase": { "type": "string" },
          "verdict": { "enum": ["proceed", "replan", "halt"] },
          "timestamp": { "type": "string", "format": "date-time" }
        }
      }
    }
  }
}
